{"name":"windows.system.info","version":"0.1.0","description":"读取 Windows 系统和执行器版本。","input_schema":{"type":"object","additionalProperties":false},"output_schema":{"type":"object","additionalProperties":false,"required":["os_version","executor_version"],"properties":{"os_version":{"type":"string"},"executor_version":{"type":"string"}}},"executor":"windows","risk_level":"low","permissions":{"resource":"system.version","actions":["read"]},"side_effects":"none","default_timeout_ms":3000,"max_timeout_ms":10000,"cancellation":{"supported":true,"cleanup":"无副作用，无需清理"},"audit":{"record":"调用身份、工具、参数摘要、结果状态","sensitive_fields":[]},"errors":["permission_denied","timeout","internal_error"],"validation_cases":["正常读取","权限拒绝","超时"]}
